{
  "format": "b10x-domain-graph/1",
  "domain": {
    "id": "commission.responsibility",
    "display": "Responsibility",
    "summary": "An agent revision commissioned to a durable case. The governor owns the case's truth and returns a `frontier`; a run is one bounded period of execution against it. The executor proposes; it never completes a case.",
    "system": "commission",
    "source": "commission ess/ compiled with ess 0.52.0"
  },
  "entities": [
    {
      "id": "commission.responsibility.Agent",
      "name": "Agent",
      "identity": {
        "name": "agent_id",
        "type": "AgentId"
      },
      "fields": [
        {
          "name": "name",
          "type": "string"
        }
      ],
      "lifecycle": {
        "initial": "Registered",
        "states": [
          "Registered"
        ],
        "terminal": [
          "Registered"
        ]
      }
    },
    {
      "id": "commission.responsibility.AgentRevision",
      "name": "AgentRevision",
      "identity": {
        "name": "agent_revision_id",
        "type": "AgentRevisionId"
      },
      "fields": [
        {
          "name": "agent_id",
          "type": "AgentId"
        },
        {
          "name": "revision",
          "type": "integer"
        }
      ],
      "lifecycle": {
        "initial": "Published",
        "states": [
          "Published"
        ],
        "terminal": [
          "Published"
        ]
      }
    },
    {
      "id": "commission.responsibility.AuthorityDecision",
      "name": "AuthorityDecision",
      "identity": {
        "name": "authority_decision_id",
        "type": "AuthorityDecisionId"
      },
      "fields": [
        {
          "name": "action",
          "type": "string"
        },
        {
          "name": "granted",
          "type": "boolean"
        }
      ],
      "lifecycle": {
        "initial": "Decided",
        "states": [
          "Decided"
        ],
        "terminal": [
          "Decided"
        ]
      }
    },
    {
      "id": "commission.responsibility.Case",
      "name": "Case",
      "identity": {
        "name": "case_id",
        "type": "CaseId"
      },
      "fields": [
        {
          "name": "protocol",
          "type": "string"
        },
        {
          "name": "revision",
          "type": "integer"
        }
      ],
      "lifecycle": {
        "initial": "Open",
        "states": [
          "Open"
        ],
        "terminal": [
          "Open"
        ]
      }
    },
    {
      "id": "commission.responsibility.Commission",
      "name": "Commission",
      "identity": {
        "name": "commission_id",
        "type": "CommissionId"
      },
      "fields": [
        {
          "name": "agent_revision_id",
          "type": "AgentRevisionId"
        },
        {
          "name": "case_id",
          "type": "CaseId"
        },
        {
          "name": "principal",
          "type": "PrincipalId"
        },
        {
          "name": "authority_context",
          "type": "AuthorityContext"
        }
      ],
      "lifecycle": {
        "initial": "Assigned",
        "states": [
          "Assigned"
        ],
        "terminal": [
          "Assigned"
        ]
      }
    },
    {
      "id": "commission.responsibility.Evidence",
      "name": "Evidence",
      "identity": {
        "name": "evidence_id",
        "type": "EvidenceId"
      },
      "fields": [
        {
          "name": "case_id",
          "type": "CaseId"
        },
        {
          "name": "kind",
          "type": "string"
        },
        {
          "name": "subject_revision",
          "type": "integer"
        },
        {
          "name": "producer",
          "type": "string"
        },
        {
          "name": "observation_ids",
          "type": "List<ObservationId>"
        },
        {
          "name": "facts",
          "type": "json"
        },
        {
          "name": "provenance",
          "type": "json"
        }
      ],
      "lifecycle": {
        "initial": "Submitted",
        "states": [
          "Submitted"
        ],
        "terminal": [
          "Submitted"
        ]
      }
    },
    {
      "id": "commission.responsibility.Frontier",
      "name": "Frontier",
      "identity": {
        "name": "frontier_id",
        "type": "FrontierId"
      },
      "fields": [
        {
          "name": "case_id",
          "type": "CaseId"
        },
        {
          "name": "case_revision",
          "type": "integer"
        },
        {
          "name": "claims",
          "type": "List<FrontierClaim>"
        },
        {
          "name": "obligations",
          "type": "List<FrontierObligation>"
        },
        {
          "name": "actions",
          "type": "List<FrontierAction>"
        }
      ],
      "lifecycle": {
        "initial": "Issued",
        "states": [
          "Issued"
        ],
        "terminal": [
          "Issued"
        ]
      }
    },
    {
      "id": "commission.responsibility.Observation",
      "name": "Observation",
      "identity": {
        "name": "observation_id",
        "type": "ObservationId"
      },
      "fields": [
        {
          "name": "source",
          "type": "string"
        },
        {
          "name": "subject",
          "type": "string"
        },
        {
          "name": "observed_at",
          "type": "timestamp"
        },
        {
          "name": "payload",
          "type": "json"
        }
      ],
      "lifecycle": {
        "initial": "Reported",
        "states": [
          "Reported"
        ],
        "terminal": [
          "Reported"
        ]
      }
    },
    {
      "id": "commission.responsibility.Run",
      "name": "Run",
      "identity": {
        "name": "run_id",
        "type": "RunId"
      },
      "fields": [
        {
          "name": "commission_id",
          "type": "CommissionId"
        },
        {
          "name": "case_revision",
          "type": "integer"
        }
      ],
      "lifecycle": {
        "initial": "Running",
        "states": [
          "Running",
          "Suspended"
        ],
        "transitions": [
          {
            "name": "suspend",
            "from": [
              "Running"
            ],
            "to": "Suspended",
            "commands": [
              "SuspendRun"
            ]
          },
          {
            "name": "resume",
            "from": [
              "Suspended"
            ],
            "to": "Running",
            "commands": [
              "ResumeRun"
            ]
          }
        ]
      },
      "createdBy": [
        "StartRun"
      ]
    }
  ],
  "relations": [
    {
      "from": "commission.responsibility.Agent",
      "to": "commission.responsibility.AgentRevision",
      "name": "revisions",
      "kind": "owns",
      "cardinality": "many",
      "via": "agent_id"
    },
    {
      "from": "commission.responsibility.Commission",
      "to": "commission.responsibility.AgentRevision",
      "name": "agent_revision",
      "kind": "references",
      "cardinality": "one",
      "via": "agent_revision_id"
    },
    {
      "from": "commission.responsibility.Commission",
      "to": "commission.responsibility.Case",
      "name": "case",
      "kind": "references",
      "cardinality": "one",
      "via": "case_id"
    },
    {
      "from": "commission.responsibility.Commission",
      "to": "commission.responsibility.Run",
      "name": "runs",
      "kind": "owns",
      "cardinality": "many",
      "via": "commission_id"
    },
    {
      "from": "commission.responsibility.Evidence",
      "to": "commission.responsibility.Case",
      "name": "case",
      "kind": "references",
      "cardinality": "one",
      "via": "case_id"
    },
    {
      "from": "commission.responsibility.Evidence",
      "to": "commission.responsibility.Observation",
      "name": "observations",
      "kind": "references",
      "cardinality": "many",
      "via": "observation_ids"
    },
    {
      "from": "commission.responsibility.Frontier",
      "to": "commission.responsibility.Case",
      "name": "case",
      "kind": "references",
      "cardinality": "one",
      "via": "case_id"
    }
  ]
}
